
UC1=>Create Database For address book;

mysql> CREATE DATABASE addressBookService;//Created Database
Query OK, 1 row affected (0.00 sec)


mysql> use addressBookService;			    //Selected database
Database changed


UC2=>Create Table


mysql> CREATE TABLE address_book(id int unsigned 
NOT NULL AUTO_INCREMENT
,first_name varchar(256) 
NOT NULL,last_name varchar(256) NOT NULL,
city varchar(256) NOT NULL
,state varchar(256) NOT NULL,zip int(11)
,phone_number BIGINT NOT NULL,PRIMARY KEY (id));   //Query For Create Table
Query OK, 0 rows affected (0.03 sec)
mysql> describe address_book;
+--------------+------------------+------+-----+---------+----------------+
| Field        | Type             | Null | Key | Default | Extra          |
+--------------+------------------+------+-----+---------+----------------+
| id           | int(10) unsigned | NO   | PRI | NULL    | auto_increment |
| first_name   | varchar(256)     | NO   |     | NULL    |                |
| last_name    | varchar(256)     | NO   |     | NULL    |                |
| city         | varchar(256)     | NO   |     | NULL    |                |
| state        | varchar(256)     | NO   |     | NULL    |                |
| zip          | int(11)          | YES  |     | NULL    |                |
| phone_number | bigint(20)       | NO   |     | NULL    |                |
+--------------+------------------+------+-----+---------+----------------+
7 rows in set (0.00 sec)



UC3=>Ability To Insert New Contacts


mysql> INSERT INTO address_book(first_name,last_name,city,
state,zip,phone_number) 
values('vinit','kumar','lucknow','punjab',909090,1234567890); //Query For Insert New Contact In to Table
Query OK, 1 row affected (0.00 sec)

mysql> select * from address_book;                           //Retrieve The Data From Table
+----+------------+-----------+---------+--------+--------+--------------+
| id | first_name | last_name | city    | state  | zip    | phone_number |
+----+------------+-----------+---------+--------+--------+--------------+
|  1 | vinit      | kumar     | lucknow | punjab | 909090 |   1234567890 |
+----+------------+-----------+---------+--------+--------+--------------+
1 row in set (0.00 sec)


UC4=>Ability To Edit Contact By Using Name


mysql> UPDATE address_book set first_name='noufal',last_name='mc',city='Calicut'
,state='Kerala',zip=7878790,phone_number=9087654321 where first_name='vinit';   //Query For Update Query
Query OK, 1 row affected (0.00 sec)
Rows matched: 1  Changed: 1  Warnings: 0


mysql> select * from address_book;
+----+------------+-----------+---------+--------+---------+--------------+
| id | first_name | last_name | city    | state  | zip     | phone_number |
+----+------------+-----------+---------+--------+---------+--------------+
|  1 | noufal     | mc        | Calicut | Kerala | 7878790 |   9087654321 |
+----+------------+-----------+---------+--------+---------+--------------+
1 row in set (0.00 sec)


UC5=>Ability To Delete A Person


mysql> delete from address_book where first_name='noufal';//Delete Query
Query OK, 1 row affected (0.01 sec)



UC6=>Ability To Retrieve Person Belonging To State or City

mysql> select * from address_book where city='Kochi' or state='Kerala';
+----+------------+-----------+-------+--------+--------+--------------+
| id | first_name | last_name | city  | state  | zip    | phone_number |
+----+------------+-----------+-------+--------+--------+--------------+
|  3 | noufal     | mc        | Kochi | Kerala | 909123 |   1234567898 |
+----+------------+-----------+-------+--------+--------+--------------+
1 row in set (0.00 sec)